Symbol,Name,Last Sale,Net Change,% Change,Market Cap,Country,IPO Year,Volume,Sector,Industry
ABAT,American Battery Technology Company Common Stock,$1.03,-0.02,-1.905%,60356077.00,United States,,233655,Basic Materials,Metal Mining
AEM,Agnico Eagle Mines Limited Common Stock,$81.86,2.76,3.489%,40920691536.00,Canada,,3199865,Basic Materials,Precious Metals
AG,First Majestic Silver Corp. Ordinary Shares (Canada),$5.79,0.62,11.992%,1746304854.00,Canada,,14921154,Basic Materials,Precious Metals
AGI,Alamos Gold Inc. Class A Common Shares,$20.06,1.15,6.081%,8419536240.00,Canada,2015,6898488,Basic Materials,Precious Metals
AMLI,American Lithium Corp. Common Stock,$0.3801,0.0207,5.76%,82694366.00,Canada,,177479,Basic Materials,Metal Mining
AMWD,American Woodmark Corporation Common Stock,$85.02,2.39,2.892%,1317584017.00,United States,1986,163868,Basic Materials,Forest Products
ASM,Avino Silver & Gold Mines Ltd. Common Shares (Canada),$1.04,0.0441,4.428%,138390933.00,Canada,,1053579,Basic Materials,Metal Mining
AU,AngloGold Ashanti PLC Ordinary Shares,$27.95,0.55,2.007%,11731449475.00,South Africa,,3475254,Basic Materials,Precious Metals
AUMN,Golden Minerals Company Common Stock,$0.27,0.0001,0.037%,4059463.00,United States,,225453,Basic Materials,Precious Metals
AUST,Austin Gold Corp. Common Shares,$0.9247,0.0447,5.08%,12272387.00,,2022,82146,Basic Materials,Precious Metals
BTG,B2Gold Corp Common shares (Canada),$3.10,0.36,13.139%,4063473521.00,Canada,,41046241,Basic Materials,Precious Metals
BVN,Buenaventura Mining Company Inc.,$12.51,0.52,4.337%,3177375706.00,Peru,1996,1773478,Basic Materials,Metal Mining
CCJ,Cameco Corporation Common Stock,$40.74,0.76,1.901%,17729256503.00,Canada,1996,4459538,Basic Materials,Other Metals and Minerals
CDE,Coeur Mining Inc. Common Stock,$6.85,1.10,19.13%,2734841443.00,United States,,16528708,Basic Materials,Precious Metals
CGAU,Centerra Gold Inc. Common Shares,$6.98,0.36,5.438%,1484811998.00,Canada,2021,605514,Basic Materials,Precious Metals
CHNR,China Natural Resources Inc. Common Stock,$0.609,-0.1186,-16.30%,6008252.00,Hong Kong,,274590,Basic Materials,Precious Metals
CLF,Cleveland-Cliffs Inc. Common Stock,$11.35,0.22,1.977%,5312258892.00,United States,,14562950,Basic Materials,Metal Mining
CLW,Clearwater Paper Corporation Common Stock,$28.81,0.82,2.93%,479169101.00,United States,,365273,Basic Materials,Paper
CMCL,Caledonia Mining Corporation Plc Common Shares,$13.92,0.87,6.667%,267097976.00,Canada,,105415,Basic Materials,Precious Metals
CRML,Critical Metals Corp. Ordinary Shares,$7.10,0.58,8.896%,643544000.00,British Virgin Islands,,16485,Basic Materials,Metal Mining
CRMLW,Critical Metals Corp. Warrants,$0.2725,0.025,10.101%,24699400.00,British Virgin Islands,,41762,Basic Materials,Metal Mining
CTGO,Contango ORE Inc. Common Stock,$21.09,0.04,0.19%,256146655.00,United States,2021,123624,Basic Materials,Precious Metals
DC,Dakota Gold Corp. Common Stock,$2.24,0.06,2.752%,209803926.00,United States,2022,156766,Basic Materials,Metal Mining
DNN,Denison Mines Corp Ordinary Shares (Canada),$1.62,0.03,1.887%,1445639291.00,Canada,,11489281,Basic Materials,Other Metals and Minerals
DRD,DRDGOLD Limited American Depositary Shares,$8.26,0.40,5.089%,714150274.00,South Africa,,331219,Basic Materials,Precious Metals
EGO,Eldorado Gold Corporation Ordinary Shares,$17.79,0.93,5.516%,3642703136.00,Canada,,1701617,Basic Materials,Precious Metals
EMX,EMX Royalty Corporation Common Shares (Canada),$1.73,0.09,5.488%,196402224.00,Canada,,324120,Basic Materials,Metal Mining
EQX,Equinox Gold Corp. Common Shares,$6.22,0.57,10.088%,2665301865.00,Canada,,5527076,Basic Materials,Precious Metals
ERO,Ero Copper Corp. Common Shares,$20.62,1.38,7.173%,2128656459.00,Canada,2021,311574,Basic Materials,Metal Mining
EU,enCore Energy Corp. Common Shares,$3.73,0.08,2.192%,687825536.00,United States,,1018149,Basic Materials,Other Metals and Minerals
EVA,Enviva Inc. Common Stock,$0.4051,-0.0012,-0.295%,30178547.00,United States,2015,602068,Basic Materials,Forest Products
EXK,Endeavour Silver Corporation Ordinary Shares (Canada),$3.48,0.35,11.182%,856146339.00,Canada,,6652770,Basic Materials,Precious Metals
FBIN,Fortune Brands Innovations Inc. Common Stock,$81.13,1.75,2.205%,10068856078.00,United States,,705938,Basic Materials,Forest Products
FCX,Freeport-McMoRan Inc. Common Stock,$41.81,0.51,1.235%,60074962572.00,United States,,11414189,Basic Materials,Metal Mining
FMST,Foremost Lithium Resource & Technology Ltd. Common stock,$2.9704,-0.0596,-1.967%,16290559.00,Canada,,2387,Basic Materials,Other Metals and Minerals
FMSTW,Foremost Lithium Resource & Technology Ltd. Warrant,$0.3135,-0.0895,-22.208%,1719327.00,Canada,,700,Basic Materials,Other Metals and Minerals
FNV,Franco-Nevada Corporation,$125.01,3.64,2.999%,24055261392.00,Canada,,536923,Basic Materials,Precious Metals
FSM,Fortuna Mining Corp. Common Shares,$4.72,0.37,8.506%,1478921513.00,Canada,,9530265,Basic Materials,Precious Metals
FURY,Fury Gold Mines Limited Common Shares,$0.4076,0.0149,3.794%,59541027.00,,2020,107852,Basic Materials,Precious Metals
GATO,Gatos Silver Inc. Common Stock,$14.58,1.54,11.81%,1010995090.00,United States,2020,1940770,Basic Materials,Precious Metals
GFI,Gold Fields Limited American Depositary Shares,$14.01,0.46,3.395%,12518506790.00,South Africa,,3951147,Basic Materials,Precious Metals
GLDG,GoldMining Inc. Common Shares,$0.9863,0.0054,0.551%,186139848.00,,,1853652,Basic Materials,Precious Metals
GLT,Glatfelter Corporation Common Stock,$1.50,0.00,0.00%,68095698.00,United States,2000,160995,Basic Materials,Paper
GOLD,Barrick Gold Corporation Common Stock (BC),$20.58,0.82,4.15%,36071273540.00,Canada,,23202060,Basic Materials,Precious Metals
GORO,Gold Resource Corporation Common Stock,$0.3466,0.0031,0.902%,32415082.00,United States,,1268259,Basic Materials,Precious Metals
GROY,Gold Royalty Corp. Common Shares,$1.24,0.04,3.333%,209648557.00,Canada,2021,2102627,Basic Materials,Precious Metals
GSM,Ferroglobe PLC Ordinary Shares,$4.14,-0.11,-2.588%,777844285.00,United Kingdom,,803497,Basic Materials,Metal Mining
HBM,Hudbay Minerals Inc. Ordinary Shares (Canada),$7.20,0.24,3.448%,2833937129.00,Canada,,3519582,Basic Materials,Metal Mining
HMY,Harmony Gold Mining Company Limited,$9.52,0.73,8.305%,5884045173.00,South Africa,,7114801,Basic Materials,Precious Metals
HYMC,Hycroft Mining Holding Corporation Class A Common Stock,$2.26,0.19,9.179%,54290061.00,United States,2018,448171,Basic Materials,Precious Metals
HYMCL,Hycroft Mining Holding Corporation Warrants,$0.0228,-0.002,-8.065%,547705.00,United States,,9349,Basic Materials,Precious Metals
HYMCW,Hycroft Mining Holding Corporation  Warrant,$0.0158,0.00,0.00%,379550.00,United States,2018,2217,Basic Materials,Precious Metals
IAG,Iamgold Corporation Ordinary Shares,$5.35,0.41,8.30%,3051105000.00,Canada,,8440265,Basic Materials,Precious Metals
IAUX,i-80 Gold Corp. Common Shares,$1.06,0.083,8.495%,407990529.00,Canada,2022,3098891,Basic Materials,Precious Metals
IDR,Idaho Strategic Resources Inc. Common Stock,$13.75,0.02,0.146%,178180393.00,,2022,194697,Basic Materials,Precious Metals
IE,Ivanhoe Electric Inc. Common Stock,$7.61,0.68,9.812%,915531811.00,Canada,2022,686318,Basic Materials,Metal Mining
IP,International Paper Company Common Stock,$47.94,0.81,1.719%,16652905288.00,United States,,3473008,Basic Materials,Paper
IPX,IperionX Limited American Depositary Share,$18.24,0.55,3.109%,352933001.00,United States,,16256,Basic Materials,Other Metals and Minerals
ITRG,Integra Resources Corp. Common Shares,$0.9553,0.0582,6.488%,84504598.00,,,100089,Basic Materials,Precious Metals
JELD,JELD-WEN Holding Inc. Common Stock,$13.99,0.38,2.792%,1182751478.00,United States,2017,968746,Basic Materials,Forest Products
KGC,Kinross Gold Corporation Common Stock,$9.78,0.63,6.885%,12019620000.00,Canada,2001,17283002,Basic Materials,Precious Metals
KOP,Koppers Holdings Inc. Common Stock,$36.66,0.74,2.06%,752237391.00,United States,2006,116642,Basic Materials,Forest Products
LAC,Lithium Americas Corp. Common Shares,$2.47,0.13,5.556%,398411000.00,Canada,2023,3930788,Basic Materials,Metal Mining
LITM,Snow Lake Resources Ltd. Common Shares,$0.36,-0.0191,-5.038%,7315124.00,Canada,2021,786229,Basic Materials,Other Metals and Minerals
LPX,Louisiana-Pacific Corporation Common Stock,$94.79,0.54,0.573%,6661456637.00,United States,,451638,Basic Materials,Forest Products
LZM,Lifezone Metals Limited Ordinary Shares,$6.18,0.15,2.488%,483708303.00,Isle of Man,,108815,Basic Materials,Metal Mining
MAG,MAG Silver Corporation Ordinary Shares,$13.69,1.10,8.737%,1412501549.00,Canada,,776712,Basic Materials,Precious Metals
MATV,Mativ Holdings Inc. Common Stock,$17.86,0.38,2.174%,970279952.00,United States,,203791,Basic Materials,Paper
MERC,Mercer International Inc. Common Stock,$6.41,0.28,4.568%,428641661.00,Canada,,491706,Basic Materials,Paper
MP,MP Materials Corp. Common Stock,$13.79,-0.05,-0.361%,2280636107.00,United States,2020,2690109,Basic Materials,Metal Mining
MTA,Metalla Royalty & Streaming Ltd. Common Shares,$3.22,0.20,6.623%,295431104.00,,,615947,Basic Materials,Precious Metals
MTAL,Metals Acquisition Limited Ordinary Shares,$11.00,0.65,6.28%,814607893.00,United States,,349941,Basic Materials,Metal Mining
MUX,McEwen Mining Inc. Common Stock,$9.36,0.58,6.606%,478160420.00,Canada,,678820,Basic Materials,Precious Metals
NAK,Northern Dynasty Minerals Ltd. Common Stock,$0.3544,0.0135,3.96%,190569485.00,Canada,,527401,Basic Materials,Precious Metals
NB,NioCorp Developments Ltd. Common Stock,$1.78,-0.075,-4.043%,67444200.00,United States,,53193,Basic Materials,Metal Mining
NEM,Newmont Corporation,$52.88,2.14,4.218%,60676060749.00,United States,,10198396,Basic Materials,Precious Metals
NEWP,New Pacific Metals Corp. Common Shares,$1.42,0.09,6.767%,243195758.00,Canada,2021,246792,Basic Materials,Precious Metals
NEXA,Nexa Resources S.A. Common Shares,$6.40,0.30,4.918%,847607110.00,Luxembourg,2017,14610,Basic Materials,Metal Mining
NFGC,New Found Gold Corp Common Shares,$2.68,0.09,3.475%,532886941.00,,2021,722338,Basic Materials,Precious Metals
NG,Novagold Resources Inc.,$4.39,0.42,10.579%,1468150830.00,Canada,2003,1350864,Basic Materials,Precious Metals
NGD,New Gold Inc.,$2.89,0.25,9.47%,2284834000.00,Canada,,14114604,Basic Materials,Metal Mining
NIOBW,NioCorp Developments Ltd. Warrant,$0.11,0.004,3.774%,4167900.00,United States,,1614,Basic Materials,Metal Mining
NMG,Nouveau Monde Graphite Inc. Common Shares,$1.43,0.06,4.38%,160951721.00,,,17627,Basic Materials,Other Metals and Minerals
NVA,Nova Minerals Limited American Depositary Shares,$6.10,0.10,1.667%,27659114.00,Australia,2024,17382,Basic Materials,Precious Metals
NXE,Nexgen Energy Ltd. Common Shares,$5.83,0.15,2.641%,3292175331.00,Canada,2017,3504783,Basic Materials,Other Metals and Minerals
ODV,Osisko Development Corp. Common Shares,$2.12,0.11,5.473%,181129467.00,Canada,2022,317621,Basic Materials,Precious Metals
ODVWZ,Osisko Development Corp. Warrant expiring 5/27/2027,$0.47,0.25,113.636%,40156061.00,Canada,,355,Basic Materials,Precious Metals
OR,Osisko Gold Royalties Ltd Common Shares,$17.77,0.79,4.653%,3309292635.00,Canada,2016,653421,Basic Materials,Precious Metals
ORLA,Orla Mining Ltd. Common Shares,$4.29,0.12,2.878%,1373893478.00,,2020,607757,Basic Materials,Precious Metals
PAAS,Pan American Silver Corp. Common Stock,$20.51,1.22,6.325%,7474664400.00,Canada,,4533139,Basic Materials,Precious Metals
PLG,Platinum Group Metals Ltd. Ordinary Shares (Canada),$1.35,0.13,10.656%,138348200.00,Canada,,611694,Basic Materials,Precious Metals
PPTA,Perpetua Resources Corp. Common Shares,$8.71,0.17,1.991%,561886551.00,Canada,,401149,Basic Materials,Precious Metals
PZG,Paramount Gold Nevada Corp. Common Stock,$0.44,-0.003,-0.677%,27996501.00,United States,2015,209963,Basic Materials,Metal Mining
RIO,Rio Tinto Plc Common Stock,$61.91,0.70,1.144%,77553646381.00,Australia,2002,2776105,Basic Materials,Metal Mining
RYAM,Rayonier Advanced Materials Inc. Common Stock,$7.48,0.12,1.63%,492877381.00,United States,2014,462090,Basic Materials,Paper
SA,Seabridge Gold Inc. Ordinary Shares (Canada),$17.49,0.92,5.552%,1565120756.00,Canada,,563664,Basic Materials,Precious Metals
SAND          ,Sandstorm Gold Ltd. Ordinary Shares (Canada),$6.02,0.38,6.738%,1790274436.00,Canada,,3285455,Basic Materials,Precious Metals
SBSW,D/B/A Sibanye-Stillwater Limited ADS,$3.73,0.34,10.029%,2639320260.00,South Africa,,13458307,Basic Materials,Precious Metals
SCCO,Southern Copper Corporation Common Stock,$98.00,1.55,1.607%,76553607578.00,United States,,896817,Basic Materials,Metal Mining
SGML,Sigma Lithium Corporation Common Shares,$10.22,-0.39,-3.676%,1132891722.00,Canada,,780153,Basic Materials,Metal Mining
SILV,SilverCrest Metals Inc. Common Shares,$8.92,0.76,9.314%,1325100342.00,Canada,2018,2287476,Basic Materials,Precious Metals
SKE,Skeena Resources Limited Common Shares,$8.68,0.81,10.292%,925718441.00,,2021,404393,Basic Materials,Precious Metals
SLVM,Sylvamo Corporation Common Stock,$74.78,1.10,1.493%,3066079831.00,United States,2021,144852,Basic Materials,Paper
SOJE,Southern Company (The) Series 2020C 4.20% Junior Subordinated Notes due October 15 2060,$21.58,0.09,0.419%,23620728604.00,United States,2020,32100,Basic Materials,Metal Mining
SUZ,Suzano S.A. American Depositary Shares (each representing One Ordinary Share),$9.67,-0.12,-1.226%,12610817337.00,Brazil,2018,2227020,Basic Materials,Paper
SVM,Silvercorp Metals Inc. Common Shares,$3.73,0.35,10.355%,807515902.00,Canada,,3469054,Basic Materials,Precious Metals
TGB,Taseko Mines Ltd. Common Stock,$2.05,0.09,4.592%,601370366.00,Canada,,3039579,Basic Materials,Precious Metals
THM,International Tower Hill Mines Ltd. Ordinary Shares (Canada),$0.525,0.0121,2.359%,104839057.00,Canada,,317076,Basic Materials,Metal Mining
TMC,TMC the metals company Inc. Common Stock,$0.912,-0.0273,-2.906%,295481631.00,Canada,,810543,Basic Materials,Metal Mining
TMCWW,TMC the metals company Inc. Warrants,$0.08,0.0008,1.01%,25919441.00,Canada,,22324,Basic Materials,Metal Mining
TMQ,Trilogy Metals Inc. Common Stock,$0.50,-0.0022,-0.438%,80276404.00,Canada,,51334,Basic Materials,Precious Metals
TREX,Trex Company Inc. Common Stock,$64.12,0.58,0.913%,6970273412.00,United States,,625413,Basic Materials,Forest Products
TRX,TRX Gold Corporation Common Stock,$0.385,0.01,2.667%,107635769.00,Canada,,262043,Basic Materials,Precious Metals
UEC,Uranium Energy Corp. Common Stock,$5.25,0.07,1.351%,2146086343.00,Canada,,5578079,Basic Materials,Other Metals and Minerals
UFPI,UFP Industries Inc. Common Stock,$117.33,3.89,3.429%,7147572416.00,United States,1993,316513,Basic Materials,Forest Products
URG,Ur Energy Inc Common Shares (Canada),$1.18,0.01,0.855%,427483353.00,Canada,,2976420,Basic Materials,Precious Metals
USAS,Americas Gold and Silver Corporation Common Shares no par value,$0.2725,0.0155,6.031%,68402931.00,Canada,2017,959285,Basic Materials,Metal Mining
USAU,U.S. Gold Corp. Common Stock,$5.86,0.58,10.985%,62891143.00,United States,,215305,Basic Materials,Metal Mining
USGO,U.S. GoldMining Inc. Common stock,$5.39,-0.0598,-1.097%,66829042.00,United States,2023,14251,Basic Materials,Precious Metals
USGOW,U.S. GoldMining Inc. Warrant,$0.5999,0.00,0.00%,7437986.00,United States,2023,1,Basic Materials,Precious Metals
VALE,VALE S.A.  American Depositary Shares Each Representing one common share,$10.37,0.15,1.468%,44279900000.00,Brazil,,21332035,Basic Materials,Metal Mining
VGZ,Vista Gold Corp Common Stock,$0.66,0.0403,6.503%,80710848.00,United States,1986,676390,Basic Materials,Precious Metals
VOXR,Vox Royalty Corp. Common Stock,$2.71,0.10,3.831%,136522843.00,Canada,,177336,Basic Materials,Precious Metals
VZLA,Vizsla Silver Corp. Common Shares,$2.05,0.11,5.67%,486898928.00,Canada,2024,1092277,Basic Materials,Precious Metals
WFG,West Fraser Timber Co. Ltd Common stock,$88.26,1.50,1.729%,7093798208.00,,2021,91138,Basic Materials,Forest Products
WPM,Wheaton Precious Metals Corp Common Shares (Canada),$61.37,2.10,3.543%,27839817881.00,Canada,,1534965,Basic Materials,Precious Metals
WRN,Western Copper and Gold Corporation Common Stock,$1.12,-0.025,-2.183%,222005487.00,Canada,2011,123418,Basic Materials,Metal Mining
WWR,Westwater Resources Inc. Common Stock,$0.5153,0.0011,0.214%,29970157.00,United States,,236478,Basic Materials,Metal Mining
XPL,Solitario Resources Corp. Common Stock,$0.79,0.0786,11.049%,64336350.00,United States,,219634,Basic Materials,Precious Metals
