Symbol,Name,Last Sale,Net Change,% Change,Market Cap,Country,IPO Year,Volume,Sector,Industry
ADTN,ADTRAN Holdings Inc. Common Stock,$5.25,0.07,1.351%,415968247.00,United States,1994,299980,Utilities,Telecommunications Equipment
AEE,Ameren Corporation Common Stock,$83.50,-0.24,-0.287%,22279196538.00,United States,,1404512,Utilities,Power Generation
AEP,American Electric Power Company Inc. Common Stock,$102.99,-0.06,-0.058%,54803038285.00,United States,,2098087,Utilities,Electric Utilities: Central
AES,The AES Corporation Common Stock,$18.12,0.26,1.456%,12881948570.00,United States,,9276015,Utilities,Electric Utilities: Central
AGR,Avangrid Inc. Common Stock,$35.74,-0.01,-0.028%,13828199998.00,United States,2015,282385,Utilities,Electric Utilities: Central
AKTS,Akoustis Technologies Inc. Common Stock,$0.0611,-0.0006,-0.972%,6670287.00,United States,,16211837,Utilities,Telecommunications Equipment
ALCE,Alternus Clean Energy Inc. Class A Common Stock,$0.191,0.0011,0.579%,16583893.00,United States,2022,32496,Utilities,Power Generation
ALE,Allete Inc.,$63.75,0.00,0.00%,3681786454.00,United States,,281528,Utilities,Power Generation
AM,Antero Midstream Corporation Common Stock,$14.59,0.30,2.099%,7021597990.00,United States,2017,1577985,Utilities,Natural Gas Distribution
AMPS,Altus Power Inc. Class A Common Stock,$3.33,0.02,0.604%,535420177.00,United States,2021,400916,Utilities,Electric Utilities: Central
AQN,Algonquin Power & Utilities Corp. Common Shares,$5.39,0.04,0.748%,4134076100.00,United States,2016,7680211,Utilities,Electric Utilities: Central
AQNB,Algonquin Power & Utilities Corp. 6.20% Fixed-to-Floating Subordinated Notes Series 2019-A due July 1 2079,$25.98,0.00,0.00%,19926400200.00,United States,2019,51105,Utilities,Electric Utilities: Central
AROC,Archrock Inc. Common Stock,$19.15,0.26,1.376%,3235184359.00,United States,,1356976,Utilities,Natural Gas Distribution
ARTNA,Artesian Resources Corporation Class A Common Stock,$37.49,-0.27,-0.715%,385980544.00,United States,,13336,Utilities,Water Supply
ATO,Atmos Energy Corporation Common Stock,$134.77,-0.01,-0.007%,20920728095.00,United States,,795645,Utilities,Oil/Gas Transmission
AUDC,AudioCodes Ltd. Common Stock,$9.72,0.17,1.78%,296525639.00,Israel,1999,27165,Utilities,Telecommunications Equipment
AVA,Avista Corporation Common Stock,$37.63,-0.17,-0.45%,2961622526.00,United States,,544940,Utilities,Power Generation
AWK,American Water Works Company Inc. Common Stock,$147.13,0.09,0.061%,28670198192.00,United States,2008,706811,Utilities,Water Supply
AWR,American States Water Company Common Stock,$81.65,0.24,0.295%,3058380298.00,United States,,158549,Utilities,Water Supply
AWX,Avalon Holdings Corporation Common Stock,$2.44,0.00,0.00%,9514612.00,United States,1998,1832,Utilities,Environmental Services
AY,Atlantica Sustainable Infrastructure plc Ordinary Shares,$21.90,0.01,0.046%,2541607259.00,United Kingdom,2014,569989,Utilities,Electric Utilities: Central
BEP,Brookfield Renewable Partners L.P. ,$26.24,1.00,3.962%,12631881106.00,Canada,,1183556,Utilities,Electric Utilities: Central
BEPC,Brookfield Renewable Corporation Class A Subordinate Voting Shares ,$30.07,1.00,3.44%,11249564830.00,United States,2020,740642,Utilities,Electric Utilities: Central
BEPH,Brookfield BRP Holdings (Canada) Inc. 4.625% Perpetual Subordinated Notes,$17.51,-0.06,-0.341%,5028247593.00,Canada,,8194,Utilities,Electric Utilities: Central
BEPI,Brookfield BRP Holdings (Canada) Inc. 4.875% Perpetual Subordinated Notes,$18.53,0.06,0.325%,5321155220.00,Canada,2021,12725,Utilities,Electric Utilities: Central
BEPJ,Brookfield BRP Holdings (Canada) Inc. 7.250% Perpetual Subordinated Notes,$25.66,-0.09,-0.35%,7368636964.00,Canada,2024,4870,Utilities,Electric Utilities: Central
BIPH,Brookfield Infrastructure Corporation 5.000% Subordinated Notes due 2081,$19.33,0.38,2.005%,8917778979.00,Canada,2021,25343,Utilities,Oil & Gas Production
BIPJ,Brookfield Infrastructure Corporation 7.250% Subordinated Notes due 2084,$26.00,0.11,0.425%,11994943272.00,Canada,2024,5821,Utilities,Oil & Gas Production
BKH,Black Hills Corporation Common Stock,$59.39,-0.18,-0.302%,4142360921.00,United States,,247967,Utilities,Electric Utilities: Central
CDZI,CADIZ Inc. Common Stock,$3.13,0.14,4.682%,212514984.00,United States,,172661,Utilities,Water Supply
CDZIP,Cadiz Inc. Depositary Shares,$15.09,-0.02,-0.132%,1024553069.00,United States,,2073,Utilities,Water Supply
CEG,Constellation Energy Corporation Common Stock ,$189.93,2.68,1.431%,59389036964.00,United States,,2154488,Utilities,Electric Utilities: Central
CEPU,Central Puerto S.A. American Depositary Shares (each represents ten Common Shares),$10.15,0.08,0.794%,1536732594.00,,2018,338185,Utilities,Electric Utilities: Central
CGBS,Crown LNG Holdings Limited Ordinary Shares,$0.3379,-0.0196,-5.483%,23308134.00,Jersey,,430789,Utilities,Oil/Gas Transmission
CGBSW,Crown LNG Holdings Limited Warrants,$0.0128,-0.0056,-30.435%,882936.00,Jersey,,66310,Utilities,Oil/Gas Transmission
CIEN,Ciena Corporation Common Stock,$54.53,1.23,2.308%,7875615216.00,United States,1997,1330759,Utilities,Telecommunications Equipment
CIG,Comp En De Mn Cemig ADS American Depositary Shares,$2.07,0.00,0.00%,5923886745.00,Brazil,,570101,Utilities,Electric Utilities: Central
CLFD,Clearfield Inc. Common Stock,$38.25,0.73,1.946%,544601320.00,United States,,66087,Utilities,Telecommunications Equipment
CLNE,Clean Energy Fuels Corp. Common Stock,$2.93,0.07,2.448%,654642282.00,United States,2007,1022672,Utilities,Natural Gas Distribution
CLRO,ClearOne Inc. (DE) Common Stock,$0.585,-0.005,-0.847%,14021952.00,United States,,22970,Utilities,Telecommunications Equipment
CMS,CMS Energy Corporation Common Stock,$69.31,0.08,0.116%,20704937348.00,United States,,1714019,Utilities,Power Generation
CMSA,CMS Energy Corporation 5.625% Junior Subordinated Notes due 2078,$25.42,0.11,0.435%,7593702314.00,United States,2018,12466,Utilities,Power Generation
CMSC,CMS Energy Corporation 5.875% Junior Subordinated Notes due 2078,$25.225,-0.015,-0.059%,7535450074.00,United States,2018,25466,Utilities,Power Generation
CMSD,CMS Energy Corporation 5.875% Junior Subordinated Notes due 2079,$25.19,0.06,0.239%,7524994543.00,United States,2019,30781,Utilities,Power Generation
CNP,CenterPoint Energy Inc (Holding Co) Common Stock,$27.59,-0.36,-1.288%,17711868978.00,United States,,6768482,Utilities,Electric Utilities: Central
CPK,Chesapeake Utilities Corporation Common Stock,$120.57,1.31,1.098%,2706787940.00,United States,,108111,Utilities,Oil & Gas Production
CQP,Cheniere Energy Partners LP Common Units,$48.96,0.44,0.907%,23698775782.00,United States,2007,102000,Utilities,Oil/Gas Transmission
CTRI,Centuri Holdings Inc. Common Stock,$17.19,0.32,1.897%,1521616186.00,,2024,225052,Utilities,Oil & Gas Production
CWCO,Consolidated Water Co. Ltd. Ordinary Shares,$25.45,0.53,2.127%,402986982.00,Cayman Islands,,66888,Utilities,Water Supply
CWEN,Clearway Energy Inc. Class C Common Stock,$28.41,0.08,0.282%,3323970000.00,United States,2015,733136,Utilities,Electric Utilities: Central
CWST,Casella Waste Systems Inc. Class A Common Stock,$106.41,1.66,1.585%,6186027980.00,United States,1997,160099,Utilities,Environmental Services
CWT,California Water Service Group Common Stock,$53.35,0.06,0.113%,3138319992.00,United States,,172168,Utilities,Water Supply
D,Dominion Energy Inc. Common Stock,$57.18,-0.05,-0.087%,47970497655.00,United States,,3121778,Utilities,Electric Utilities: Central
DTB,DTE Energy Company 2020 Series G 4.375% Junior Subordinated Debentures due 2080,$21.10,0.14,0.668%,4368123688.00,United States,2020,18911,Utilities,Electric Utilities: Central
DTE,DTE Energy Company Common Stock,$124.49,0.11,0.088%,25771929759.00,United States,,933108,Utilities,Electric Utilities: Central
DTG,DTE Energy Company 2021 Series E 4.375% Junior Subordinated Debentures,$21.03,0.15,0.718%,4353632282.00,United States,2021,14375,Utilities,Electric Utilities: Central
DTM,DT Midstream Inc. Common Stock ,$75.52,1.03,1.383%,7333873772.00,United States,2021,524305,Utilities,Natural Gas Distribution
DTW,DTE Energy Company 2017 Series E 5.25% Junior Subordinated Debentures due 2077,$24.53,-0.04,-0.163%,5078202562.00,United States,2017,17695,Utilities,Electric Utilities: Central
DUK,Duke Energy Corporation (Holding Company) Common Stock,$115.97,-0.23,-0.198%,89552231845.00,United States,,2390256,Utilities,Power Generation
DUKB,Duke Energy Corporation 5.625% Junior Subordinated Debentures due 2078,$25.47,0.08,0.315%,19667977452.00,United States,2018,23441,Utilities,Power Generation
EAI,Entergy Arkansas LLC First Mortgage Bonds 4.875% Series Due September 1 2066,$22.93,0.09,0.394%,4903141299.00,United States,2016,75963,Utilities,Electric Utilities: Central
EBR,Centrais Electricas Brasileiras S A American Depositary Shares (Each representing one Common Share),$7.37,-0.07,-0.941%,16551651258.00,Brazil,2016,656476,Utilities,Electric Utilities: Central
ED,Consolidated Edison Inc. Common Stock,$103.39,-0.43,-0.414%,35788159008.00,United States,,1528602,Utilities,Power Generation
EDN,Empresa Distribuidora Y Comercializadora Norte S.A. (Edenor) American Depositary Shares,$23.29,0.52,2.284%,1055566964.00,Argentina,2007,169894,Utilities,Electric Utilities: Central
EE,Excelerate Energy Inc. Class A Common Stock,$18.51,0.41,2.265%,1981915436.00,United States,2022,118135,Utilities,Oil/Gas Transmission
EIX,Edison International Common Stock,$84.63,0.39,0.463%,32682138014.00,United States,,1920519,Utilities,Electric Utilities: Central
ELC,Entergy Louisiana Inc. Collateral Trust Mortgage Bonds 4.875 % Series due September 1 2066,$22.90,0.07,0.307%,4883139941.00,United States,2016,20868,Utilities,Electric Utilities: Central
ELLO,Ellomay Capital Ltd Ordinary Shares (Israel),$12.75,-0.16,-1.239%,163870459.00,Israel,,10520,Utilities,Electric Utilities: Central
ELP,Companhia Paranaense de Energia (COPEL) American Depositary Shares (each representing one Unit consisting one Common Share and four non-voting Class B Preferred Shares),$7.60,-0.05,-0.654%,2470659870.00,Brazil,2021,115788,Utilities,Electric Utilities: Central
ELPC,Companhia Paranaense de Energia (COPEL) American Depositary Shares (each representing four (4) Common Shares),$6.83,0.03,0.441%,2220343015.00,Brazil,2023,6883,Utilities,Electric Utilities: Central
EMP,Entergy Mississippi LLC First Mortgage Bonds 4.90% Series Due October 1 2066,$23.04,0.07,0.305%,4926662692.00,United States,2016,14838,Utilities,Electric Utilities: Central
ENIC,Enel Chile S.A. American Depositary Shares (Each representing 50 shares of Common Stock),$2.64,0.01,0.38%,3651994220.00,Chile,2016,542720,Utilities,Electric Utilities: Central
ENJ,Entergy New Orleans LLC First Mortgage Bonds 5.0% Series due December 1 2052,$23.1141,0.00,0.00%,4942507558.00,United States,,100,Utilities,Power Generation
ENLC,EnLink Midstream LLC Common Units representing Limited Partner Interests,$14.51,0.08,0.554%,6695631679.00,United States,,989380,Utilities,Natural Gas Distribution
ENLT,Enlight Renewable Energy Ltd. Ordinary Shares,$16.81,0.50,3.066%,1982951541.00,Israel,2023,2942,Utilities,Electric Utilities: Central
ENO,Entergy New Orleans LLC First Mortgage Bonds 5.50% Series due April 1 2066,$24.27,0.13,0.539%,5189674632.00,United States,2016,5562,Utilities,Power Generation
EPD,Enterprise Products Partners L.P. Common Stock,$29.40,0.25,0.858%,63806868216.00,United States,,2336367,Utilities,Natural Gas Distribution
ES,Eversource Energy (D/B/A) Common Stock,$67.50,-0.29,-0.428%,24123469478.00,United States,,1684977,Utilities,Electric Utilities: Central
ESGL,ESGL Holdings Limited Ordinary Shares,$1.70,0.35,25.926%,62560000.00,Singapore,,59574,Utilities,Environmental Services
ESGLW,ESGL Holdings Limited Warrants,$0.0118,0.0018,18.00%,434240.00,Singapore,,11900,Utilities,Environmental Services
ET,Energy Transfer LP Common Units ,$16.00,0.13,0.819%,54755741712.00,United States,,7368977,Utilities,Natural Gas Distribution
ETR,Entergy Corporation Common Stock,$123.55,1.32,1.08%,26418801023.00,United States,,1571724,Utilities,Electric Utilities: Central
EVRG,Evergy Inc. Common Stock,$60.36,0.28,0.466%,13880291197.00,United States,,1536252,Utilities,Power Generation
EXC,Exelon Corporation Common Stock,$39.86,0.56,1.425%,39879858531.00,United States,,19881385,Utilities,Power Generation
FE,FirstEnergy Corp. Common Stock,$44.06,-0.09,-0.204%,25375141693.00,United States,,2225215,Utilities,Electric Utilities: Central
FKWL,Franklin Wireless Corp. Common Stock,$4.11,-0.04,-0.964%,48433391.00,United States,,11874,Utilities,Telecommunications Equipment
FN,Fabrinet Ordinary Shares,$221.79,4.93,2.273%,8017933839.00,Cayman Islands,2010,534704,Utilities,Telecommunications Equipment
FTS,Fortis Inc. Common Shares,$45.18,0.42,0.938%,22373136000.00,United States,2016,427686,Utilities,Electric Utilities: Central
GFL,GFL Environmental Inc. Subordinate voting shares no par value,$40.26,-0.51,-1.251%,15159467588.00,Canada,2020,4846256,Utilities,Environmental Services
GNE,Genie Energy Ltd. Class B Common Stock Stock,$17.48,0.24,1.392%,470091528.00,United States,2011,90271,Utilities,Power Generation
GPJA,Georgia Power Company Series 2017A 5.00% Junior Subordinated Notes due October 1 2077,$25.04,0.10,0.401%,231907960.00,United States,2017,6483,Utilities,Electric Utilities: Central
GWRS,Global Water Resources Inc. Common Stock,$12.99,0.14,1.089%,314584156.00,United States,2016,51313,Utilities,Water Supply
HE,Hawaiian Electric Industries Inc. Common Stock,$11.17,-0.11,-0.975%,1232089492.00,United States,,1251235,Utilities,Electric Utilities: Central
IDA,IDACORP Inc. Common Stock,$103.00,-0.28,-0.271%,5485154172.00,United States,,220768,Utilities,Electric Utilities: Central
INFN,Infinera Corporation Common Stock,$6.47,0.04,0.622%,1524743143.00,United States,2007,21366672,Utilities,Telecommunications Equipment
KEN,Kenon Holdings Ltd. Ordinary Shares,$25.63,0.73,2.932%,1352388607.00,Singapore,2015,4770,Utilities,Electric Utilities: Central
KEP,Korea Electric Power Corporation Common Stock,$8.22,0.04,0.489%,10553889426.00,South Korea,1994,59354,Utilities,Electric Utilities: Central
KGS,Kodiak Gas Services Inc. Common Stock,$26.24,-0.01,-0.038%,2217532219.00,United States,2023,573775,Utilities,Natural Gas Distribution
KMI,Kinder Morgan Inc. Common Stock,$20.94,0.11,0.528%,46475547158.00,United States,2011,9023005,Utilities,Natural Gas Distribution
KNTK,Kinetik Holdings Inc. Class A Common Stock,$43.53,0.13,0.30%,6856797630.00,United States,2022,319805,Utilities,Natural Gas Distribution
LNG,Cheniere Energy Inc. Common Stock,$177.21,0.60,0.34%,40097862962.00,United States,2001,924085,Utilities,Oil/Gas Transmission
LNT,Alliant Energy Corporation Common Stock,$58.91,-0.09,-0.153%,15110389963.00,United States,,951980,Utilities,Power Generation
MNTK,Montauk Renewables Inc. Common Stock,$4.38,0.00,0.00%,629026683.00,United States,2021,151083,Utilities,Natural Gas Distribution
MSEX,Middlesex Water Company Common Stock,$62.94,1.15,1.861%,1122206227.00,United States,,103322,Utilities,Water Supply
NEP,NextEra Energy Partners LP Common Units representing limited partner interests,$25.18,-0.07,-0.277%,2355318516.00,United States,2014,903267,Utilities,Electric Utilities: Central
NEXT,NextDecade Corporation Common Stock,$4.59,-0.01,-0.217%,1190986913.00,United States,2015,923734,Utilities,Oil & Gas Production
NFE,New Fortress Energy Inc. Class A Common Stock,$10.91,0.22,2.058%,2237281483.00,United States,2019,2523608,Utilities,Oil/Gas Transmission
NFG,National Fuel Gas Company Common Stock,$59.18,-1.33,-2.198%,5406500336.00,United States,,586875,Utilities,Oil/Gas Transmission
NGG,National Grid Transco PLC National Grid PLC (NEW) American Depositary Shares,$69.27,-0.05,-0.072%,67688791374.00,United Kingdom,,342605,Utilities,Natural Gas Distribution
NGL,NGL ENERGY PARTNERS LP Common Units representing Limited Partner Interests,$4.49,0.06,1.354%,594982319.00,United States,2011,324387,Utilities,Natural Gas Distribution
NI,NiSource Inc Common Stock,$33.63,0.07,0.209%,15083385818.00,United States,,4370817,Utilities,Power Generation
NJR,NewJersey Resources Corporation Common Stock,$46.44,0.15,0.324%,4605341672.00,United States,,415378,Utilities,Oil/Gas Transmission
NNE,Nano Nuclear Energy Inc. Common Stock,$11.70,0.85,7.834%,352493657.00,United States,2024,4208257,Utilities,Electric Utilities: Central
NOVA,Sunnova Energy International Inc. Common Stock,$10.75,-0.47,-4.189%,1342292881.00,United States,2019,2570295,Utilities,Power Generation
NRG,NRG Energy Inc. Common Stock,$79.80,-0.27,-0.337%,16469110594.00,United States,,1793499,Utilities,Electric Utilities: Central
NTGR,NETGEAR Inc. Common Stock,$20.84,4.91,30.822%,597664546.00,United States,2003,3260613,Utilities,Telecommunications Equipment
NWE,NorthWestern Energy Group Inc. Common Stock,$55.46,0.88,1.612%,3399725564.00,United States,,429641,Utilities,Power Generation
NWN,Northwest Natural Holding Company Common Stock,$39.30,0.25,0.64%,1519741690.00,United States,,187764,Utilities,Oil/Gas Transmission
OGE,OGE Energy Corp Common Stock,$40.01,0.08,0.20%,8036699193.00,United States,,611563,Utilities,Electric Utilities: Central
OGS,ONE Gas Inc. Common Stock,$71.16,0.46,0.651%,4031523617.00,United States,2014,511727,Utilities,Oil/Gas Transmission
OKE,ONEOK Inc. Common Stock,$90.50,0.26,0.288%,52858690122.00,United States,,2333220,Utilities,Oil & Gas Production
OKLO,Oklo Inc. Class A common stock,$6.23,0.13,2.131%,760659762.00,United States,2021,1498195,Utilities,Electric Utilities: Central
OPAL,OPAL Fuels Inc. Class A Common Stock,$3.36,-0.07,-2.041%,580681325.00,United States,2021,39429,Utilities,Natural Gas Distribution
OPTT,Ocean Power Technologies Inc. Common Stock,$0.1853,0.003,1.646%,17178974.00,United States,2007,3005426,Utilities,Electric Utilities: Central
ORA,Ormat Technologies Inc. Common Stock,$74.24,0.54,0.733%,4488041336.00,United States,2004,285934,Utilities,Electric Utilities: Central
OTTR,Otter Tail Corporation Common Stock,$77.05,1.52,2.012%,3222844857.00,United States,,195337,Utilities,Electric Utilities: Central
PAM,Pampa Energia S.A.,$58.99,0.30,0.511%,3208209965.00,Argentina,,259481,Utilities,Electric Utilities: Central
PCG,Pacific Gas & Electric Co. Common Stock,$19.67,0.02,0.102%,56641329965.00,United States,,20863636,Utilities,Power Generation
PCYO,Pure Cycle Corporation Common Stock,$10.09,0.07,0.699%,242920201.00,United States,,21031,Utilities,Water Supply
PEG,Public Service Enterprise Group Incorporated Common Stock,$83.31,1.11,1.35%,41501848561.00,United States,,2950749,Utilities,Power Generation
PEGY,Pineapple Energy Inc. Common Stock,$0.1847,0.0105,6.028%,1611254.00,United States,,113891213,Utilities,Telecommunications Equipment
PNW,Pinnacle West Capital Corporation Common Stock,$89.22,0.25,0.281%,10136418565.00,United States,,673730,Utilities,Electric Utilities: Central
POR,Portland General Electric Co Common Stock,$47.53,-0.30,-0.627%,4898759443.00,United States,,676913,Utilities,Electric Utilities: Central
PPL,PPL Corporation Common Stock,$31.96,0.01,0.031%,23579234796.00,United States,,4367934,Utilities,Electric Utilities: Central
QRHC,Quest Resource Holding Corporation Common Stock,$8.60,0.25,2.994%,175297696.00,United States,,18033,Utilities,Environmental Services
RGCO,RGC Resources Inc. Common Stock,$20.76,0.88,4.427%,212144239.00,United States,,7133,Utilities,Oil & Gas Production
RNW,ReNew Energy Global plc Class A Ordinary Shares,$6.26,0.02,0.321%,504302282.00,United Kingdom,,590409,Utilities,Electric Utilities: Central
RNWWW,ReNew Energy Global plc Warrant,$0.4084,0.0283,7.445%,32900488.00,United Kingdom,,101071,Utilities,Electric Utilities: Central
RSG,Republic Services Inc. Common Stock,$205.24,0.44,0.215%,64459375224.00,United States,1998,885270,Utilities,Environmental Services
SBS,Companhia de saneamento Basico Do Estado De Sao Paulo - Sabesp American Depositary Shares (Each repstg 250 Common Shares),$16.78,-0.03,-0.178%,11469295602.00,Brazil,2002,681566,Utilities,Water Supply
SJW,SJW Group Common Stock (DE),$58.18,0.00,0.00%,1903160888.00,United States,1972,130962,Utilities,Water Supply
SLNG,Stabilis Solutions Inc. Common Stock,$4.0505,-0.0095,-0.234%,75278599.00,United States,,2197,Utilities,Oil/Gas Transmission
SMC,Summit Midstream Corporation Common Stock,$36.98,-0.24,-0.645%,393788371.00,United States,2012,72638,Utilities,Natural Gas Distribution
SO,Southern Company (The) Common Stock,$88.49,-0.28,-0.315%,96858122067.00,United States,,3527145,Utilities,Electric Utilities: Central
SOJC,Southern Company (The) Series 2017B 5.25% Junior Subordinated Notes due December 1 2077,$24.83,0.02,0.081%,27178067250.00,United States,2017,16000,Utilities,Electric Utilities: Central
SOJD,Southern Company (The) Series 2020A 4.95% Junior Subordinated Notes due January 30 2080,$24.07,0.01,0.042%,26346197290.00,United States,2020,94982,Utilities,Electric Utilities: Central
SONM,Sonim Technologies Inc. Common Stock,$2.62,0.05,1.946%,12671567.00,United States,2019,22475,Utilities,Telecommunications Equipment
SR,Spire Inc. Common Stock,$65.01,0.24,0.371%,3754358315.00,United States,,424699,Utilities,Oil/Gas Transmission
SRE,DBA Sempra Common Stock,$81.70,0.33,0.406%,51728017988.00,United States,,2331509,Utilities,Natural Gas Distribution
SREA,DBA Sempra 5.750% Junior Subordinated Notes due 2079,$24.97,-0.02,-0.08%,15809652499.00,United States,2019,85625,Utilities,Natural Gas Distribution
SUUN,SolarBank Corporation Common Stock,$3.92,-0.02,-0.508%,129556000.00,Canada,,12940,Utilities,Power Generation
SWX,Southwest Gas Holdings Inc. Common Stock (DE),$69.91,0.32,0.46%,5013349567.00,United States,,232313,Utilities,Oil & Gas Production
TAC,TransAlta Corporation Ordinary Shares,$9.14,0.11,1.218%,2728290000.00,Canada,,313636,Utilities,Electric Utilities: Central
TGS,Transportadora de Gas del Sur SA TGS Common Stock,$20.96,0.39,1.896%,3155574364.00,Argentina,,141008,Utilities,Natural Gas Distribution
TLN,Talen Energy Corporation Common Stock,$155.99,3.89,2.558%,7955716186.00,United States,,684584,Utilities,Electric Utilities: Central
TRGP,Targa Resources Inc. Common Stock,$146.72,2.00,1.382%,32143375638.00,United States,2010,1305137,Utilities,Natural Gas Distribution
TRP,TC Energy Corporation Common Stock,$46.09,0.21,0.458%,47795330000.00,Canada,,4237282,Utilities,Natural Gas Distribution
TVC,Tennessee Valley Authority Common Stock,$23.15,0.17,0.74%,253175114.00,United States,,6750,Utilities,Electric Utilities: Central
TVE,Tennessee Valley Authority,$22.52,0.00,0.00%,17924254421.00,United States,,12681,Utilities,Electric Utilities: Central
TXNM,TXNM Energy Inc. Common Stock,$41.59,0.72,1.762%,3751433971.00,United States,,883479,Utilities,Electric Utilities: Central
UGI,UGI Corporation Common Stock,$23.49,0.03,0.128%,5043035895.00,United States,,2129869,Utilities,Natural Gas Distribution
UGP,Ultrapar Participacoes S.A. (New) American Depositary Shares (Each representing one Common Share),$4.09,0.02,0.491%,4456061818.00,Brazil,,950720,Utilities,Oil/Gas Transmission
USAC,USA Compression Partners LP Common Units Representing Limited Partner Interests,$22.52,0.63,2.878%,2635006896.00,United States,2013,183579,Utilities,Natural Gas Distribution
UTL,UNITIL Corporation Common Stock,$59.12,0.97,1.668%,956205166.00,United States,1985,37738,Utilities,Power Generation
VIASP,Via Renewables Inc. 8.75% Series A Fixed-to-Floating Rate Cumulative Redeemable Perpetual Preferred Stock,$21.39,-0.25,-1.155%,156646007.00,United States,,2520,Utilities,Power Generation
VIVK,Vivakor Inc. Common Stock,$1.66,-0.01,-0.599%,48597723.00,United States,,22320,Utilities,Environmental Services
VST,Vistra Corp. Common Stock,$80.47,0.41,0.512%,27646386099.00,United States,,3860486,Utilities,Electric Utilities: Central
VVPR,VivoPower International PLC Ordinary Shares,$2.04,0.01,0.493%,9057600.00,United Kingdom,,34597,Utilities,Power Generation
WAVE,Eco Wave Power Global AB (publ) American Depositary Shares,$3.77,0.08,2.168%,20923500.00,Israel,2021,7005,Utilities,Electric Utilities: Central
WCN,Waste Connections Inc. Common Shares,$185.99,0.60,0.324%,47992379932.00,Canada,,666883,Utilities,Environmental Services
WEC,WEC Energy Group Inc. Common Stock,$95.01,-0.20,-0.21%,30030703889.00,United States,,1607458,Utilities,Power Generation
WES,Western Midstream Partners LP Common Units Representing Limited Partner Interests,$38.86,0.56,1.462%,14785923161.00,United States,2012,624383,Utilities,Natural Gas Distribution
WM,Waste Management Inc. Common Stock,$207.86,0.22,0.106%,83417299940.00,United States,,1582980,Utilities,Environmental Services
WMB,Williams Companies Inc. (The) Common Stock,$45.09,0.51,1.144%,54961607402.00,United States,,5540775,Utilities,Natural Gas Distribution
WTRG,Essential Utilities Inc. Common Stock,$38.46,-0.56,-1.435%,10525428197.00,United States,,1263584,Utilities,Water Supply
XEL,Xcel Energy Inc. Common Stock,$63.89,0.04,0.063%,35618718509.00,United States,,4886474,Utilities,Power Generation
YORW,York Water Company (The) Common Stock,$38.31,0.24,0.63%,550212166.00,United States,,27094,Utilities,Water Supply
